{
  "concept_family": "switching",
  "concept_id": "l2-infrastructure",
  "concept_name": "L2 Infrastructure",
  "confidence": "medium",
  "dependencies": [
    {
      "description": "Requires physical layer connectivity — copper or fiber with proper speed/duplex negotiation",
      "name": "Physical Ethernet connectivity",
      "type": "infrastructure"
    }
  ],
  "failure_modes": [
    {
      "description": "Two ends of an 802.1Q trunk have different native VLANs configured. Untagged traffic from one side is placed into the wrong VLAN on the other, causing traffic leaking between VLANs (security risk) and connectivity loss for devices on either native VLAN. Tagged VLAN traffic works normally, making this hard to detect.",
      "resolutions": [
        {
          "action": "Check native VLAN on both ends: 'show interfaces trunk' — native VLAN column must match",
          "os": "nxos",
          "version_range": {
            "max": "*",
            "min": "*"
          }
        },
        {
          "action": "Check native VLAN on both ends: 'show interfaces trunk' — native VLAN column must match",
          "os": "iosxe",
          "version_range": {
            "max": "*",
            "min": "*"
          }
        },
        {
          "action": "Check native VLAN on both ends: 'show interfaces trunk' — native VLAN column must match",
          "os": "iosxr",
          "version_range": {
            "max": "*",
            "min": "*"
          }
        },
        {
          "action": "Set matching native VLAN: 'switchport trunk native vlan <N>' on both ends",
          "os": "nxos",
          "version_range": {
            "max": "*",
            "min": "*"
          }
        },
        {
          "action": "Set matching native VLAN: 'switchport trunk native vlan <N>' on both ends",
          "os": "iosxe",
          "version_range": {
            "max": "*",
            "min": "*"
          }
        },
        {
          "action": "Set matching native VLAN: 'switchport trunk native vlan <N>' on both ends",
          "os": "iosxr",
          "version_range": {
            "max": "*",
            "min": "*"
          }
        },
        {
          "action": "Best practice: use an unused VLAN as native (e.g., VLAN 999) and tag all real traffic",
          "os": "nxos",
          "version_range": {
            "max": "*",
            "min": "*"
          }
        },
        {
          "action": "Best practice: use an unused VLAN as native (e.g., VLAN 999) and tag all real traffic",
          "os": "iosxe",
          "version_range": {
            "max": "*",
            "min": "*"
          }
        },
        {
          "action": "Best practice: use an unused VLAN as native (e.g., VLAN 999) and tag all real traffic",
          "os": "iosxr",
          "version_range": {
            "max": "*",
            "min": "*"
          }
        },
        {
          "action": "Enable 'vlan dot1q tag native' (IOS-XE) to tag the native VLAN and eliminate the ambiguity entirely",
          "os": "nxos",
          "version_range": {
            "max": "*",
            "min": "*"
          }
        },
        {
          "action": "Enable 'vlan dot1q tag native' (IOS-XE) to tag the native VLAN and eliminate the ambiguity entirely",
          "os": "iosxe",
          "version_range": {
            "max": "*",
            "min": "*"
          }
        },
        {
          "action": "Enable 'vlan dot1q tag native' (IOS-XE) to tag the native VLAN and eliminate the ambiguity entirely",
          "os": "iosxr",
          "version_range": {
            "max": "*",
            "min": "*"
          }
        }
      ],
      "root_causes": [
        {
          "cause": "Different 'switchport trunk native vlan <N>' configured on each end of the trunk",
          "os": "*",
          "version_range": {
            "max": "*",
            "min": "*"
          }
        },
        {
          "cause": "One end configured as access port (native VLAN = access VLAN) and the other as trunk",
          "os": "*",
          "version_range": {
            "max": "*",
            "min": "*"
          }
        },
        {
          "cause": "Default native VLAN (1) on one end, changed native VLAN on the other",
          "os": "*",
          "version_range": {
            "max": "*",
            "min": "*"
          }
        },
        {
          "cause": "Copy-paste error during switch provisioning",
          "os": "*",
          "version_range": {
            "max": "*",
            "min": "*"
          }
        }
      ],
      "scenario": "Native VLAN mismatch on trunk link",
      "symptoms": [
        "CDP/LLDP syslog: '%CDP-4-NATIVE_VLAN_MISMATCH: Native VLAN mismatch discovered on <intf>'",
        "Hosts on the native VLAN have intermittent or no connectivity",
        "Traffic from VLAN X on one switch appears in VLAN Y on the other",
        "Security concern: untagged traffic crosses VLAN boundaries",
        "All tagged VLANs work fine — only untagged (native VLAN) traffic is affected"
      ],
      "verify_commands": [
        {
          "command": "show interfaces trunk",
          "confirms_if": "Shows native VLAN per trunk interface",
          "look_for": "Compare 'Native VLAN' column for each trunk — both ends must match",
          "os": "nxos",
          "version_range": {
            "max": "*",
            "min": "*"
          }
        },
        {
          "command": "show interfaces trunk",
          "confirms_if": "Shows native VLAN per trunk interface",
          "look_for": "Compare 'Native VLAN' column for each trunk — both ends must match",
          "os": "iosxe",
          "version_range": {
            "max": "*",
            "min": "*"
          }
        },
        {
          "command": "show interfaces trunk",
          "confirms_if": "Shows native VLAN per trunk interface",
          "look_for": "Compare 'Native VLAN' column for each trunk — both ends must match",
          "os": "iosxr",
          "version_range": {
            "max": "*",
            "min": "*"
          }
        },
        {
          "command": "show cdp neighbors detail",
          "confirms_if": "CDP actively detects and reports native VLAN mismatches",
          "look_for": "Look for native VLAN mismatch messages in CDP output",
          "os": "nxos",
          "version_range": {
            "max": "*",
            "min": "*"
          }
        },
        {
          "command": "show cdp neighbors detail",
          "confirms_if": "CDP actively detects and reports native VLAN mismatches",
          "look_for": "Look for native VLAN mismatch messages in CDP output",
          "os": "iosxe",
          "version_range": {
            "max": "*",
            "min": "*"
          }
        },
        {
          "command": "show cdp neighbors detail",
          "confirms_if": "CDP actively detects and reports native VLAN mismatches",
          "look_for": "Look for native VLAN mismatch messages in CDP output",
          "os": "iosxr",
          "version_range": {
            "max": "*",
            "min": "*"
          }
        },
        {
          "command": "show logging | include NATIVE_VLAN",
          "confirms_if": "Shows history of native VLAN mismatch detections",
          "look_for": "Look for CDP native VLAN mismatch syslog messages",
          "os": "nxos",
          "version_range": {
            "max": "*",
            "min": "*"
          }
        },
        {
          "command": "show logging | include NATIVE_VLAN",
          "confirms_if": "Shows history of native VLAN mismatch detections",
          "look_for": "Look for CDP native VLAN mismatch syslog messages",
          "os": "iosxe",
          "version_range": {
            "max": "*",
            "min": "*"
          }
        },
        {
          "command": "show logging | include NATIVE_VLAN",
          "confirms_if": "Shows history of native VLAN mismatch detections",
          "look_for": "Look for CDP native VLAN mismatch syslog messages",
          "os": "iosxr",
          "version_range": {
            "max": "*",
            "min": "*"
          }
        }
      ]
    },
    {
      "description": "One side of a link is hard-coded to full duplex while the other uses auto-negotiate. The auto-negotiate side falls back to half duplex per IEEE spec (cannot detect the peer's duplex when the peer doesn't negotiate). The link comes up and appears functional, but performance is severely degraded with late collisions, FCS errors, and runt frames. Often misdiagnosed as a 'slow network' problem.",
      "resolutions": [
        {
          "action": "Check both ends: 'show interface status' — verify speed and duplex match",
          "os": "nxos",
          "version_range": {
            "max": "*",
            "min": "*"
          }
        },
        {
          "action": "Check both ends: 'show interface status' — verify speed and duplex match",
          "os": "iosxe",
          "version_range": {
            "max": "*",
            "min": "*"
          }
        },
        {
          "action": "Check both ends: 'show interface status' — verify speed and duplex match",
          "os": "iosxr",
          "version_range": {
            "max": "*",
            "min": "*"
          }
        },
        {
          "action": "Best practice: use auto-negotiate on both ends (IEEE recommendation). If one end must be forced, force BOTH ends to the same speed and duplex",
          "os": "nxos",
          "version_range": {
            "max": "*",
            "min": "*"
          }
        },
        {
          "action": "Best practice: use auto-negotiate on both ends (IEEE recommendation). If one end must be forced, force BOTH ends to the same speed and duplex",
          "os": "iosxe",
          "version_range": {
            "max": "*",
            "min": "*"
          }
        },
        {